<?xml version="1.0" encoding="UTF-8"?>
<om:core
xmlns:xsi="http://www.w3.org/2001/XMLSchema-instance"
    xmlns:om="http://solrfusion.outermedia.org/configuration/" 
    xmlns="http://solrfusion.outermedia.org/configuration/type/"
    xsi:schemaLocation="http://solrfusion.outermedia.org/configuration/ ../../main/resources/configuration.xsd "
>
    <!-- the fields of the fusion schema -->
    <!-- supported types: text, int, long, float, double, boolean, date -->
    <!-- default type is "text" -->
    <!-- mappings in <fields> below use the following field names: -->
    <om:fusion-schema-fields default-type="text">
        <om:field name="id" />
        <om:field name="city" />
        <om:field name="title" />
        <om:field name="numberExample" type="int" />
        <om:field name="longExample" type="long"/>
        <om:field name="floatExample" type="float"/>
        <om:field name="doubleExample" type="double"/>
        <om:field name="mappingExample" />
        <om:field name="computingExample" />
        <om:field name="publicationDate" type="date" format="dd.MM.yyyy" />
        <om:field name="multiValue1" multi-value="true" />
    </om:fusion-schema-fields>

    <!-- general type attribute's value in <fields> is one of the following names: -->
    <om:script-type name="javascript-file" class="org.outermedia.solrfusion.types.JsFile" />
    <om:script-type name="beanshell-file" class="org.outermedia.solrfusion.types.BshFile" />
    <om:script-type name="javascript" class="org.outermedia.solrfusion.types.Js" />
    <om:script-type name="beanshell" class="org.outermedia.solrfusion.types.Bsh" />
    <om:script-type name="java-class" class="org.outermedia.solrfusion.types.Java" />
    <om:script-type name="regexp" class="org.outermedia.solrfusion.types.RegularExpression" />
    <om:script-type name="static-table-file" class="org.outermedia.solrfusion.types.TableFile"/>
    <om:script-type name="static-table" class="org.outermedia.solrfusion.types.Table"/>
    <om:script-type name="send-if-fq-eq" class="org.outermedia.solrfusion.types.FilterSpecificFq"/>

    <om:default-search-field>title</om:default-search-field>

    <om:default-sort-field>score desc</om:default-sort-field>
    
    <!-- in a Solr query the operator is explicitly set to rewrite the default -->
    <om:default-operator>AND</om:default-operator>

    <!-- "id" is one name of <fusion-fields> -->
    <om:id-generator fusion-name="id"
        class="org.outermedia.solrfusion.DefaultIdGenerator$Factory" />

    <om:response-consolidator class="org.outermedia.solrfusion.response.PagingResponseConsolidator$Factory"/>

    <om:response-mapper class="org.outermedia.solrfusion.mapper.ResponseMapper$Factory" />

    <om:query-mapper class="org.outermedia.solrfusion.mapper.QueryMapper$Factory" />

    <om:controller class="org.outermedia.solrfusion.FusionController$Factory" />

    <om:ids-controller class="org.outermedia.solrfusion.IdsFusionController$Factory" />

    <om:solr-servers>
        <!-- global settings -->
        <om:timeout>4000</om:timeout>
        <om:disaster-limit>3</om:disaster-limit>
        <om:error key="disaster-limit">Ihre Anfrage konnte nicht von ausreichend
            vielen Systemen beantwortet werden.
        </om:error>
        <om:page-size>10</om:page-size>
        
        <!-- factory controls re-usage of created objects -->
        <om:query-parser class="org.outermedia.solrfusion.query.EdisMaxQueryParser$Factory"/>

        <om:dismax-query-parser
            class="org.outermedia.solrfusion.query.DisMaxQueryParser$Factory"/>

        <om:response-parser class="org.outermedia.solrfusion.response.DefaultResponseParser$Factory" />

        <om:response-renderer type="xml"
            class="org.outermedia.solrfusion.response.DefaultXmlResponseRenderer$Factory" />

        <om:response-renderer type="json"
            class="org.outermedia.solrfusion.response.DefaultJsonResponseRenderer$Factory" />

        <om:response-renderer type="php"
            class="org.outermedia.solrfusion.response.DefaultPhpResponseRenderer$Factory" />

        <om:query-builder class="org.outermedia.solrfusion.mapper.QueryBuilder$Factory"/>

        <om:dismax-query-builder class="org.outermedia.solrfusion.mapper.DisMaxQueryBuilder$Factory"/>

        <!-- merge solr documents of different solrs into one -->
        <!-- "prio" controls which non empty value to use at first -->
        <om:merge fusion-name="ISBN" class="org.outermedia.solrfusion.DefaultMergeStrategy$Factory">
            <om:target prio="1" target-name="BibliothekA"/>
            <om:target prio="2" target-name="BibliothekB"/>
        </om:merge>         

        <xi:include href="target/test-classes/test-server-a-mapping.xml" xmlns:xi="http://www.w3.org/2001/XInclude" />
                    
        <!-- more solr servers definitions ... -->

    </om:solr-servers>
</om:core>