<?xml version="1.0" encoding="UTF-8"?>
<!-- this schema is suitable for the solr example docs -->
<om:core xmlns:xsi="http://www.w3.org/2001/XMLSchema-instance"
    xmlns:om="http://solrfusion.outermedia.org/configuration/"
    xmlns="http://solrfusion.outermedia.org/configuration/type/"
    xsi:schemaLocation="http://solrfusion.outermedia.org/configuration/ ../../main/resources/configuration.xsd ">

    <om:fusion-schema-fields default-type="text">
        <om:field name="id"/>
        <om:field name="score" type="float"/>
        <om:field name="sku"/>
        <om:field name="name"/>
        <om:field name="manu"/>
        <om:field name="cat" multi-value="true"/>
        <om:field name="features" multi-value="true"/>
        <om:field name="includes"/>
        <om:field name="weight" type="float"/>
        <om:field name="price" type="float"/>
        <om:field name="popularity" type="int"/>
        <om:field name="inStock" type="boolean"/>
        <om:field name="store"/>
        <om:field name="title" multi-value="true"/>
        <om:field name="subject"/>
        <om:field name="description"/>
        <om:field name="comments"/>
        <om:field name="author"/>
        <om:field name="keywords"/>
        <om:field name="category"/>
        <om:field name="resourcename"/>
        <om:field name="url"/>
        <om:field name="content_type" multi-value="true"/>
        <om:field name="last_modified" type="date"/>
        <om:field name="links" multi-value="true"/>
        <om:field name="content" multi-value="true"/>
        <om:field name="text" multi-value="true"/>
        <om:field name="text_rev" multi-value="true"/>
        <om:field name="manu_exact"/>
        <om:field name="payloads"/>
        <om:field name="_version_" type="long"/>
        <om:field name="price_c" />
        <om:field name="manu_id_s" />
        <om:field name="manufacturedate_dt" />
        <om:field name="compName_s" />
        <om:field name="address_s" />
    </om:fusion-schema-fields>

    <om:script-type name="javascript" class="org.outermedia.solrfusion.types.Js"/>
    <om:script-type name="beanshell" class="org.outermedia.solrfusion.types.Bsh"/>
    <om:script-type name="merge-multi-value" class="org.outermedia.solrfusion.types.MultiValueMerger"/>
    <om:script-type name="static-value" class="org.outermedia.solrfusion.types.Value"/>
    <om:script-type name="filter-id" class="org.outermedia.solrfusion.types.IdFilter"/>
    <om:script-type name="field-merger" class="org.outermedia.solrfusion.types.FieldMerger"/>
    <om:script-type name="normalizer" class="org.outermedia.solrfusion.types.Normalizer"/>
    <om:script-type name="set-doc-count" class="org.outermedia.solrfusion.types.SetFacetDocCount"/>
    <!-- Post Processors -->
    <om:script-type name="send-if-fq-eq" class="org.outermedia.solrfusion.types.FilterSpecificFq"/>
    <om:script-type name="filter-empty-fq" class="org.outermedia.solrfusion.types.FilterEmptyFq"/>

    <om:default-search-field>allfields</om:default-search-field>

    <om:default-sort-field>score desc</om:default-sort-field>

    <om:default-operator>AND</om:default-operator>

    <om:id-generator fusion-name="id"
        class="org.outermedia.solrfusion.DefaultIdGenerator$Factory"/>

    <om:response-consolidator class="org.outermedia.solrfusion.response.PagingResponseConsolidator$Factory"/>

    <om:response-mapper class="org.outermedia.solrfusion.mapper.ResponseMapper$Factory" ignore-missing-mappings="true"/>

    <!-- The fusion query is transformed into a specific search server query -->
    <om:query-mapper class="org.outermedia.solrfusion.mapper.QueryMapper$Factory"/>

    <!-- This component controls the whole processing. -->
    <om:controller class="org.outermedia.solrfusion.FusionController$Factory"/>

    <om:solr-servers>
        <om:timeout>4000</om:timeout>
        <om:disaster-limit>0</om:disaster-limit>
        <om:error key="disaster-limit">Please try later again.</om:error>
        <om:page-size>10</om:page-size>

        <om:query-parser
            class="org.outermedia.solrfusion.query.EdisMaxQueryParser$Factory"/>

        <om:dismax-query-parser
            class="org.outermedia.solrfusion.query.DisMaxQueryParser$Factory"/>

        <om:response-parser
            class="org.outermedia.solrfusion.response.DefaultResponseParser$Factory"/>

        <om:response-renderer type="xml"
            class="org.outermedia.solrfusion.response.DefaultXmlResponseRenderer$Factory"/>

        <om:response-renderer type="json"
            class="org.outermedia.solrfusion.response.DefaultJsonResponseRenderer$Factory"/>

        <om:response-renderer type="php"
            class="org.outermedia.solrfusion.response.DefaultPhpResponseRenderer$Factory"/>

        <om:response-renderer type="javabin"
            class="org.outermedia.solrfusion.response.javabin.JavaBin4$Factory"/>

        <!-- edismax query builder -->
        <om:query-builder class="org.outermedia.solrfusion.mapper.QueryBuilder$Factory"/>

        <om:dismax-query-builder class="org.outermedia.solrfusion.mapper.DisMaxQueryBuilder$Factory"/>

        <om:solr-server name="TEST1" version="4.2.1"
            class="org.outermedia.solrfusion.adapter.solr.DefaultSolrAdapter$Factory">

            <om:url>http://localhost:8983/solr/collection1/select</om:url>

            <om:score factor="1.0"
                class="org.outermedia.solrfusion.DefaultScore$Factory"/>

            <om:unique-key>id</om:unique-key>

            <om:max-docs>100</om:max-docs>

            <!-- keep all fields in general -->
            <om:field name="*" fusion-name="*"/>

            <!-- but with the following exceptions -->
            <om:field name="id" fusion-name="id">
                <om:change>
                    <om:query type="filter-id"/>
                </om:change>
            </om:field>

            <om:field fusion-name="solr-server">
                <om:add>
                    <om:response target="facet" type="static-value">
                        <value>UBL</value>
                    </om:response>
                    <om:response target="facet" type="set-doc-count">
                        <total-found-nr/>
                    </om:response>
                </om:add>
                <om:drop>
                    <om:query/>
                </om:drop>
            </om:field>

            <om:post-processor>
                <om:query type="send-if-fq-eq">
                    <fusion-name>solr-server</fusion-name>
                    <fusion-value>UBL</fusion-value>
                </om:query>
                <om:query type="filter-empty-fq">
                    <ignore-fusion-name>solr-server</ignore-fusion-name>
                    <ignore-fusion-name>authorized_mode</ignore-fusion-name>
                </om:query>
            </om:post-processor>

        </om:solr-server>

    </om:solr-servers>
</om:core>
